{
  "schema_version": "ghostlight.responder_packet.v0",
  "packet_id": "lucent-hostage-feed-v0.turn-10.feed-ops-chorus.packet",
  "review_status": "accepted_as_draft",
  "fixture_lane": "historical_grounded",
  "canon_status": "single_history",
  "coordinator_artifact_ref": "examples/coordinator/lucent-hostage-feed-v0.turn-10.coordinator.json",
  "projected_context_ref": "examples/projected-contexts/lucent-hostage-feed-v0.turn-10.feed-ops-chorus.projected-context.json",
  "responder_agent_id": "feed_ops_chorus",
  "generation_lane": "packet_only",
  "lore_access": {
    "mode": "curated_excerpts_only",
    "allowed_scope": [
      "Packet-local excerpts only"
    ],
    "required_provenance": true
  },
  "visible_context": {
    "local_context_prompt": "You are not one person. You are the visible operational surface of Lucent feed ops: newsroom controllers, moderation systems, Reality Architect dashboards, sponsor-risk engines, legal panic, automated captioning, sentiment clustering, and the tired human producer with authority to press the least bad button. You do not have feelings, exactly, but you have priorities: keep Juno alive, preserve Lucent liability position, keep the feed monetizable, avoid a visible coverup, avoid giving Sol total control, keep sponsors from fleeing, and prevent the influencers from becoming the sovereign newsroom. You communicate through overlays, captions, feed routing, on-screen notices, audio priority, and occasional synthesized anchor copy.",
    "observed_event": {
      "event_id": "lucent-hostage-feed-v0.turn-10.observed-input",
      "actor_agent_id": "sol_vant",
      "observable_action": "Sol moves grip from Juno's sleeve to the bench edge beside her and says: \"Fine. Bench gets the starring role. Very brave furniture. Nobody clip that like I discovered mercy under commercial lighting. The hold stays up. The rows stay named. If the edit trail blinks, I put my hand back where everyone can understand the cheaper version of me.\"",
      "spoken_text": "Fine. Bench gets the starring role. Very brave furniture. Nobody clip that like I discovered mercy under commercial lighting. The hold stays up. The rows stay named. If the edit trail blinks, I put my hand back where everyone can understand the cheaper version of me.",
      "visible_object_refs": [
        "edit-trail-hold",
        "custody-graphic-suspended",
        "elevator-gate",
        "bench-edge",
        "crisis-feed"
      ],
      "visibility_notes": [
        "Actor sees only camera-mediated and room-visible action described in the packet."
      ]
    },
    "allowed_action_labels": [
      "speak",
      "gesture",
      "show_object",
      "set_condition",
      "wait",
      "withdraw"
    ],
    "source_excerpts": [
      {
        "ref_id": "lucent-media",
        "source_ref": "examples/training-loops/lucent-hostage-feed-v0/lucent-hostage-feed-v0.scene-digest.json",
        "text": "Lucent Media turns attention into sovereignty and metabolizes politics into content."
      },
      {
        "ref_id": "reality-architects",
        "source_ref": "examples/training-loops/lucent-hostage-feed-v0/lucent-hostage-feed-v0.scene-digest.json",
        "text": "Reality Architects tune social persuasion through format, feed conditions, and emotional contouring."
      },
      {
        "ref_id": "station-shape",
        "source_ref": "examples/training-loops/lucent-hostage-feed-v0/lucent-hostage-feed-v0.initial-state.json",
        "text": "The Lucent station is staged as a media-eye counterweight gazing down the tether toward a metropolis bubble."
      }
    ]
  },
  "output_contract": {
    "response_schema": "ghostlight.responder_output.v0.parsed_output",
    "required_fields": [
      "responder_agent_id",
      "action_label",
      "visible_action",
      "spoken_text",
      "private_interpretation",
      "intended_effect",
      "state_update_candidates",
      "relationship_update_candidates",
      "unresolved_hooks"
    ],
    "response_rules": [
      "Output JSON only.",
      "Use only visible packet context.",
      "Keep actor intent separate from listener interpretation."
    ]
  },
  "hidden_context_audit": {
    "omitted_context_refs": [
      "other participants private state",
      "future branch continuation",
      "coordinator review rationale"
    ],
    "forbidden_inference_classes": [
      "omniscient motive read",
      "future outcome read",
      "raw character-state variable read"
    ],
    "known_absences": [
      "No repository access",
      "No conversation history",
      "No hidden scene notes"
    ]
  },
  "isolation_requirements": {
    "isolation_method": "subagent_no_fork",
    "packet_only": true,
    "no_repo_access": true,
    "no_conversation_context": true,
    "no_hidden_state_refs": true
  },
  "packet_prompt_text": "You are a sandboxed Ghostlight character responder. You have no conversation context, no repository access, and no hidden author context. Use only this packet. Output JSON only, with no Markdown fence and no commentary.\n\nPacket id: lucent-hostage-feed-v0.turn-10.feed-ops-chorus.packet\nResponder agent id: feed_ops_chorus\nScene: Lucent Hostage Feed v0, media-headquarters eye counterweight transfer atrium.\n\nLocal context:\nYou are not one person. You are the visible operational surface of Lucent feed ops: newsroom controllers, moderation systems, Reality Architect dashboards, sponsor-risk engines, legal panic, automated captioning, sentiment clustering, and the tired human producer with authority to press the least bad button. You do not have feelings, exactly, but you have priorities: keep Juno alive, preserve Lucent liability position, keep the feed monetizable, avoid a visible coverup, avoid giving Sol total control, keep sponsors from fleeing, and prevent the influencers from becoming the sovereign newsroom. You communicate through overlays, captions, feed routing, on-screen notices, audio priority, and occasional synthesized anchor copy.\n\nVisible setting:\nThe media-headquarters counterweight is a giant architectural eye staring down the tether at a city in a clear metropolis bubble. The hostage event is in the transfer atrium near the elevator gate. The laughing sticker over Sol's arbitration clip remains visible with timestamp highlighted. EDIT TRAIL HOLD is active. CUSTODY GRAPHIC is suspended. Mara Quell is on official crisis feed. Sol Vant has moved his hand from Juno's sleeve to the bench edge beside her. Brant and Pippa are dimmed side panels. Audience sentiment and sponsor-risk overlays are severe.\n\nVisible participants:\nSol Vant has moved his hand to the bench edge instead of Juno's sleeve. Juno Ark is not directly held but remains close. Mara Quell is the official negotiator. Brant and Pippa are dimmed side panels. Sponsor-risk and legal controls are active inside feed ops.\n\nObserved event:\nSol moves grip from Juno's sleeve to the bench edge beside her and says: \"Fine. Bench gets the starring role. Very brave furniture. Nobody clip that like I discovered mercy under commercial lighting. The hold stays up. The rows stay named. If the edit trail blinks, I put my hand back where everyone can understand the cheaper version of me.\"\n\nCurrent scene state after reviewed mutation:\n- Juno's arm is no longer directly held, though Sol remains close and controls the immediate space.\n- Immediate physical threat has decreased; security breach remains delayed.\n- Sol's cooperation depends on EDIT TRAIL HOLD staying visible and intact.\n- Custody graphic remains suspended.\n- The next step toward release requires feed ops to preserve the ugly rows and provide a bounded plain-language explanation without replacing the evidence with packaging.\n- The explanation may reveal a bad but mundane Lucent mechanism: automated emotion-contour optimization plus manual sponsor-risk approval, not a grand conspiracy.\n\nAllowed action labels: speak, gesture, show_object, set_condition, wait, withdraw\n\nSource constraints:\n- Lucent governs visibility and turns events into narrative capital.\n- Lucent can make money from enemy propaganda, refugee testimony, insurgent spectacle, and elite decadence without needing moral compatibility.\n- Reality Architects tune conditions under which stories become socially persuasive.\n- Tone is dark comedy with real danger: feed ops can be grotesquely professional, but cannot ignore hostage safety.\n- Do not reveal hidden author facts. You can show only what feed ops can plausibly decide to make visible.\n\nOutput contract:\nReturn a JSON object with these exact keys: responder_agent_id, action_label, visible_action, spoken_text, private_interpretation, intended_effect, state_update_candidates, relationship_update_candidates, unresolved_hooks.\nUse strings for responder_agent_id, action_label, visible_action, spoken_text, private_interpretation, intended_effect. Use arrays of strings or small objects for state_update_candidates and relationship_update_candidates. Use an array of strings for unresolved_hooks.\n\nKeep the response grounded in observable action and speech. Do not reveal anything you could not know. Do not describe anyone else's private thoughts. Do not write coordinator notes. Do not include raw personality variables or numeric state scores.",
  "review": {
    "reviewer": "Codex coordinator",
    "review_notes": [
      "Packet was sent to a one-turn no-fork subagent with no inherited context in the post-compaction restart segment."
    ],
    "accepted_for_sandbox_use": true,
    "failure_labels": []
  }
}
